{
  "inline": {
    "protein.consent": "61b8e62846e3bbf6afcbf4ff0d9805ee01422f0717ca7f2c77ba3d97739754c9",
    "protein.policyFooter": "36e0b2787a9d4613c906486a1154836c382af7154f6783df3f382fcbf9984310",
    "diabetes.policyFooter": "36e0b2787a9d4613c906486a1154836c382af7154f6783df3f382fcbf9984310"
  },
  "pages": {
    "medical-disclaimer": "47dcde223f6981f58b5ae9b62abb663289156bbbd23c82dbdbf9cdf34a8676e7"
  },
  "reviewer": "Product owner (sudarshanalk), acting as clinical reviewer",
  "date": "2026-10-27",
  "decision": "approved",
  "messages": {
    "protein.resultHeading": "42e4f17623cc6d610a54a5b913b4ebdd92fd7c2abb805b43d62af33e2df8d075",
    "protein.disclaimerLinks": "6deb8cea513d461fcee8ffea8dbef0562cec69f951b4c311913169766c7232d5",
    "protein.scope": "261806980937824048ec07d4b06e14947183d0e6f5608104393eeeb6129f5e98",
    "protein.renalStop.title": "6b76ab7eee4e4710ecfe6ad629b835aa10d7ee68a74a6e1dabaadde15520354f",
    "protein.renalStop.body": "44da175ed798a3eb030b504d953e7fb2d9444a8b3600b36df4bb496d36ccd1ab",
    "protein.renalUnsure.title": "f60275c0997d1ec34f01d18e52e76fc9eeb52ebae4e9d88c3d37aebe8492da86",
    "protein.renalUnsure.body": "20b9af109315603941650b686c042d11f38143342407a2f9e5f522450e11317d",
    "protein.clinicalStop.title": "6760eea79ec7023a14f32063dc0b775045d401df583394a563e9193c971f4164",
    "protein.clinicalStop.body": "6e7f22b082fa0c5bcb712b44f01fd2b1df1138e8a35230100e580f6984cd70f8",
    "protein.planStop.title": "158c0796153113fad45e40b1406e653e985b589a252247d6ac9d6f894578d271",
    "protein.planStop.body": "d6cd46b7f73311399a79457cedeeeec9feee8b0ba92e3b367fa9a6446cf64c0f",
    "protein.pregnancy.title": "172678cef70f4c96441f7661c562349abdf60d41e726a6d1af75d09103f7b090",
    "protein.pregnancy.body": "3605ca983556d92e6046c1a2c656c325b02a958a1c2a6a1da85c06ee8a757014",
    "protein.underweight.title": "3c6dbacef553b34adc8ebb0275f371ec7b4a5eba69b3a16875d9ecd079d5f939",
    "protein.underweight.body": "7fa0968e3481031bcbdd2a245b37654bd2967d65d3cdd381cdee6f0b345e5bc1",
    "protein.eatingConcern": "3544b6d6d209f3849859064bb0bf5a2d58ddbb450cf5b0199f764b6d94969d30",
    "protein.interp.baseline": "51538591f24d8a957ac985e60e523faa9dc249bb633d13050bf07ab66b4440c7",
    "protein.interp.active": "39a972be503773580afa9ca942af308a8d36f0d52926a93acbfb1971cc5c0bbe",
    "protein.interp.training": "4c7308fe59fcbfa6c8432e87650af350cc480e482714fe12ac35493dba30a68d",
    "protein.interp.fatloss": "a482645b3dff77364c17dd13bdf626149c39762df3832c8438963d376d085a42",
    "protein.interp.older": "69a620c6ece3c9d0693a11b8e340b99e458cd0006410c9a82ed5ac3ad8c34ebf",
    "protein.advice.spread": "89a7992d1181bb28104df5571e63af45dc2ebfcf28d6cf7b8ac17e5f3ca4c12d",
    "protein.advice.spreadOlder": "7913870f9b99067b5e40645fc9aace08e9f0df431dbf73ce1b8d93d8ace4440f",
    "protein.advice.quality": "d08bf020628ef66f70631b9b4c38aeaacaeb021bf662dc8568463645adbe268d",
    "protein.advice.plant": "3f0a221a2065197fabe12e18591c236ac1fac86234248897df06a8e62e3fee91",
    "protein.advice.training": "6286f0d973df8b5c8ddb2a43589db135b56b23b4479b3ef40077425a5e6f1682",
    "protein.advice.perMealTraining": "470f73db0f5f017969323cc57299c4a98e464cdd98f1fb97db4d1b3efc21585d",
    "protein.advice.hydrate": "05a207bde36052f43b1f8023f9a23a99543ad4574b035f9c7aa43adbe4203bab",
    "protein.advice.food": "5aa2d13cc4498826c0ff6580394a20fa2e62ef45d3edddeb810d9aa9c55115d8",
    "protein.crossLink": "128ab15a0b559a4268af89f99b76d0122ab4fb698005391da7a028fefb8f9190",
    "protein.disclaimer": "89bc0597ad1a8b3b0f84675d0f4f018b73eda9876ea2ef763ff8b00fc7630501",
    "protein.emailSubject": "6c3330c26e57402d81737bb939df66b5d663deca481dc2e2f2e13c2d3610be04",
    "protein.emailSent": "c770896887a5081ace8cd2f1867da3646ebed4b78b26a3c95f2939dd7de0882e",
    "protein.emailFailed": "a481727f417f94bf9125aaa5ad7c0f006ec5202ade565e7026b4e7c0ef01224b",
    "protein.emailRateLimited": "b84f730379f0dca3ecd08f5c816ac67da2312af05b3c61da50cd67303e1ae53e",
    "protein.emailUnavailable": "77684f9a6da73cc0c5c90b66f2dcec1df958bb1a1e492d7bfd55a6648fc5691c",
    "protein.unavailable.title": "afa5be4bda9789c834b32e75c3077ce4d3134d6ee3e433b187206a35fe82a744",
    "protein.unavailable.body": "11d0e266a0eed430288696cd2c8ec1f66e0f4bc345f830b478601e482e3fa54e",
    "protein.unavailable.checking": "68ea019296a778f2198660b50694721f1ef2a8c3b79d48e16abaf0fb29290905",
    "protein.unavailable.unknown": "7d9e28fe5a1a04e11dc2b446a3b6aeadf86dccbfa2940d701e97cd3a668b50d4",
    "diabetes.scope": "df18eb9f1bf9f1ae2576c1a750042173e321a46df1b16788265161b5c112fb71",
    "diabetes.bands.low.label": "f793de205ead5ac302c4a1627829dea41f176b1068b993a32373fc869918374b",
    "diabetes.bands.low.interp": "3fa3fc7dbc8a7817c39c11fd04a9ceb779fd34b1a48c1515c24ae9016776c342",
    "diabetes.bands.low.nextStep": "766e022d1684f99da39c67f47ff62024faf94c6f1a7e6734bbf818cdc35e30ba",
    "diabetes.bands.moderate.label": "5c42afc7a23018d32dcff346792b575bcdf63be118b98a61084b1afac32b93e9",
    "diabetes.bands.moderate.interp": "e9034c37bd556736525dfb4a24c436c6b59c9cdaa15ebf0ce4322a89c51512e2",
    "diabetes.bands.moderate.nextStep": "f70bc12cb32cbcda93195e8c4af48a46bd6e5e8bbcc940c0189d9184878974a6",
    "diabetes.bands.high.label": "c4ebc6d4a5832cd9415f906ad03661110c705a72381c8b8b145761d02e2dd23a",
    "diabetes.bands.high.interp": "50a83bf188d1e762aa03ee687e4700b309805afd1384ccea5bbec4f0ddeabb28",
    "diabetes.bands.high.nextStep": "544c6a7c1c57b762f3d7dde887c75b95a5aea6b4168daf4013e990f9b1662d65",
    "diabetes.bands.veryHigh.label": "0a84a4fa1d288ec35bed98f50ceab1a044e37c6546da680cce0153f2f5b5044c",
    "diabetes.bands.veryHigh.interp": "6c6cefb14bc4429628ca4014f705b58ecd17f95343fabf8c6cb71df66e149ae0",
    "diabetes.bands.veryHigh.nextStep": "1ad023e0fd6ab9f6af0c2898e1c6f1902c9c3a1a3f6c6fddbd48044e596d3bda",
    "diabetes.emergency.title": "5be1968d5b81d35ef8fa41a22ba3b98eab4156b4641a1174f91126a02fdc1706",
    "diabetes.emergency.body": "148ecdb3d233c8a764c79b8147255cbfce024c8f5c3574f807b32c086d736dc6",
    "diabetes.symptomatic.title": "7c76014dc770b8b3f06b1761b03fcf591d585bb76248d5449192db9660afd0f0",
    "diabetes.symptomatic.body": "de1e3f31df0dd8da1eacf3058a6627cc59c1f94fc41affefa8253c590a2dc0f7",
    "diabetes.reconcile": "a466c5e7945d723dab2d94982c828f4b4dbeb4eb110a9ea91cbf7f16adf77504",
    "diabetes.advice.intro": "f27707ea8a86ce124d4e1591a3abd6dfd61482206578de1e50aecf64d59708a6",
    "diabetes.advice.overweight": "bbc82391da4aec2c18761b770317a26c9a7da5459b412eb17240661af1a967fe",
    "diabetes.advice.waist": "383f942bd7f42bc0296839022497417575537eb9c32d2682aeca7440bd8ffb6e",
    "diabetes.advice.smoking": "f49678dc0b7418aa28f5944bf04686582967c4b6f5b21be21c4b5851be59f173",
    "diabetes.advice.inactivity": "45c7921f969d545905aa51a55aadd40895a4dbecb9677f059b41a22c0a4f5c79",
    "diabetes.advice.family": "0e1403286060ac625bbb0aad8f2d14e723b2bac549bb716065ff327604229200",
    "diabetes.advice.hypertension": "9e55719bc6dd1ff996d2904e293b529a6d1b7ce672f40709963955fd182cc4ed",
    "diabetes.advice.general": "11b0a9deb6f9b73651a31f4cdb223e6b8fdb0e66fb1fa40ab9665f1c20ae2452",
    "diabetes.advice.dietSwap": "005df738a3d14c09ed2bba6eb3a59702dd7f7bc889aaa63b52da6979b0b5c376",
    "diabetes.secondary.heading": "0eb40034ff6020dcf7db2b07fe22af48d740d7feaf06e266c2866d276a9e31a4",
    "diabetes.secondary.idrsLabel": "de1e41397ef1ed5a456bb300f194a997e97e73aebb2e637097ad872bb9f2f7eb",
    "diabetes.secondary.whtrLabel": "57b77f0883d836970fcd77c19436a50830756fdb753955f3d417f26a4452738a",
    "diabetes.secondary.whtr.healthy": "eb6c3631621672b26054bfc2adf2d53615ac955cd10f88f18f00ee0ec20e0042",
    "diabetes.secondary.whtr.raised": "09c0902563b52b5c2f576bcd6d13b7b4b0d01ebb9d0c0a25099e50070ef4a6b3",
    "diabetes.secondary.whtr.high": "ff0e2b9e7ff208dd8c46fe12fb2c266d79cb8b32653e2307e75b31eaf9d2d260",
    "diabetes.secondary.idrs.low": "f793de205ead5ac302c4a1627829dea41f176b1068b993a32373fc869918374b",
    "diabetes.secondary.idrs.moderate": "5c42afc7a23018d32dcff346792b575bcdf63be118b98a61084b1afac32b93e9",
    "diabetes.secondary.idrs.high": "c4ebc6d4a5832cd9415f906ad03661110c705a72381c8b8b145761d02e2dd23a",
    "diabetes.secondary.needWaist": "76b60b7fabe51c222fc053c469da7365e8517df6e04ce733cbdcfcf4d13da767",
    "diabetes.method": "45589c79f8f335e0926253f18f661702795fd42895f98e5d6d72307d6bdb4098",
    "diabetes.email.heading": "f25da8b361582351b52c7232234bbdc26e5385c590b00fb72c09f000864c60f9",
    "diabetes.email.intro": "b5dffa920961503df249a4f9fc4b7a685507d1a8bd8e5181a84faaa44d466057",
    "diabetes.email.consent": "13a1127f0b2ce965c0be2e48952cb65f49a277f73998c3c147b382ff51f73923",
    "diabetes.email.success": "b7843dbba8fb10b9944e5eb3365fb6f3eb833496f6982dd0a396abf67e1e1898",
    "diabetes.email.errorValidation": "aac7e6409e4b58a5ed2d1b460b5009430086d3125d22b89cb0d39d3f22f8dfb1",
    "diabetes.email.errorServer": "cf07e21b53d1212ea0b7b1e8080818aa9c4f352206916644fb4599b0c140dba4",
    "diabetes.email.errorRateLimited": "b84f730379f0dca3ecd08f5c816ac67da2312af05b3c61da50cd67303e1ae53e",
    "diabetes.email.errorUnavailable": "77684f9a6da73cc0c5c90b66f2dcec1df958bb1a1e492d7bfd55a6648fc5691c",
    "diabetes.unavailable.title": "afa5be4bda9789c834b32e75c3077ce4d3134d6ee3e433b187206a35fe82a744",
    "diabetes.unavailable.body": "11d0e266a0eed430288696cd2c8ec1f66e0f4bc345f830b478601e482e3fa54e",
    "diabetes.unavailable.checking": "68ea019296a778f2198660b50694721f1ef2a8c3b79d48e16abaf0fb29290905",
    "diabetes.unavailable.unknown": "7d9e28fe5a1a04e11dc2b446a3b6aeadf86dccbfa2940d701e97cd3a668b50d4",
    "diabetes.disclaimerLinks": "6deb8cea513d461fcee8ffea8dbef0562cec69f951b4c311913169766c7232d5",
    "diabetes.urgentCare": "1bbd2c87d7e54858cb2c088d7364944e85a8ffd7d9f0f8034d9ee38eee62744a",
    "diabetes.disclaimer": "35156be01c5bba11cf30d1c5f88a0f71c64d63f9fa3402addab8d1e9af265ec2"
  },
  "templates": {
    "protein._shared.disclaimer": "bc14413f6b94bb999e41a5874cab1af773fe7a521bd14ecc2e84b77380c332c9",